{
    "schema_version":  2,
    "contract_version":  "popgp-viability-contract-v2",
    "requirements_version":  "popgp-viability-requirements-v2",
    "campaign_id":  "POPGP-VIABILITY-R1-2026-08",
    "candidate_commit":  "9a29e05f803666bf0e3a28417ea399e3e26769fc",
    "baseline_commit":  "70c867552279b74d5ce1a7bc5c50d5a980cf81e6",
    "tree_hash":  "358fb1af6ca587b6c71ff2ef0fb87e335163eeaf",
    "packet_freeze_version":  "popgp-packet-freeze-v4",
    "requirements":  {
                         "path":  "schemas/viability/requirements-v2.json",
                         "sha256":  "632528e8c4b19d746253719e308b3a676b5a19cffc3a734a670d1c878c161d20"
                     },
    "contract_files":  [
                           {
                               "path":  "docs/scientific_hardening/CLAIMS_MATRIX.md",
                               "sha256":  "33d0e656131b6aea52c3a644f59f91c302b777014839ceb13e5f6f93758e8e6d"
                           },
                           {
                               "path":  "docs/scientific_hardening/GATE_TEST_REGISTRY.md",
                               "sha256":  "d2281da11e99536415aed331cbb83c61ac67631e9765a6e0f82ebd577f5df43b"
                           },
                           {
                               "path":  "schemas/viability/campaign-v2.schema.json",
                               "sha256":  "13ba43394a9ae4162d47fc44662232e9c51b73d3c0a32515ab81562f3007fbca"
                           },
                           {
                               "path":  "schemas/viability/independent-rereview-v2.schema.json",
                               "sha256":  "8b0a6e224abbf09a6b33890acdb628c15c82d083d2ae8bf7273ee2a26d01e567"
                           },
                           {
                               "path":  "schemas/viability/independent-review-v2.schema.json",
                               "sha256":  "032eedcdd5651bc8deaedf06ec20805aec028eaafad8ba0eea9d8acdcc76e8a1"
                           },
                           {
                               "path":  "schemas/viability/packet-v2.schema.json",
                               "sha256":  "9278b165eafcab04bd0989d489db3fe4fe881ade0c04e7f77cad5e9d69f5217d"
                           },
                           {
                               "path":  "schemas/viability/primary-protocol-v1.schema.json",
                               "sha256":  "d3360469bf7eb5b501da9eb42350df17fa946d5c9e598b20534240fcb7d8f801"
                           },
                           {
                               "path":  "schemas/viability/protocol-manifest-v2.schema.json",
                               "sha256":  "78f3c6a0dcf59a7ed134e5df2743cc7b9cdace8cc7b312af171a8c9e0381f10d"
                           },
                           {
                               "path":  "schemas/viability/review-response-v2.schema.json",
                               "sha256":  "0719e843fced8109e37f522e538be9905b7f43fcb42a06a3eb50239258785a1d"
                           },
                           {
                               "path":  "scripts/check_viability_campaign.py",
                               "sha256":  "f3cebec20a326db062351fb25a01f01ad36bd96284262ea354f8d69349d21298"
                           }
                       ],
    "packet_rule_sha256":  {
                               "VIA-000":  "78f91b4cef5913ce344bf40d89458c9d7dcb6648ca85443a60db1781f784e547",
                               "VIA-010":  "24929a18f6414e1bc4ebf153fc0b19d0b29238d4c2626d04f715e050b181daf1",
                               "VIA-100":  "af35b67e9f046601ec08db70b41967ab52139694306244eedda5e62e8d72f202",
                               "VIA-150":  "03226be4cd8317ad74349659969ab361bac6027cdc914410a0d33f54d76e6504",
                               "VIA-200":  "d6d64c63493f42b0d8c225bbbb82b6a47fc0ce8cdf2ff8692864dc526e67437b",
                               "VIA-300":  "4a58c1f7b8a20a7595bc2453b16e6088cd97e119a945b690f097bbb81ee53cc1",
                               "VIA-400":  "c380dbc8cea736247c0e11d1e5c2029ebdb4525fc7e2280182ef1cdb09cc841c"
                           }
}
