{
  "schema_version": 2,
  "contract_version": "popgp-viability-contract-v2",
  "requirements_version": "popgp-viability-requirements-v2",
  "campaign_id": "POPGP-VIABILITY-R3-2026-08",
  "candidate_commit": "5be3c38a0822d49953d0933f14ccab32ca12c896",
  "baseline_commit": "9a29e05f803666bf0e3a28417ea399e3e26769fc",
  "tree_hash": "6ad387f9f4e0bab7f97df1bb54a03177887f0707",
  "packet_freeze_version": "popgp-packet-freeze-v4",
  "requirements": {
    "path": "schemas/viability/requirements-v2.json",
    "sha256": "632528e8c4b19d746253719e308b3a676b5a19cffc3a734a670d1c878c161d20"
  },
  "contract_files": [
    {
      "path": ".gitattributes",
      "sha256": "4b5040895e57add04a24ac83d7ea40a0b50a6ae5be979c88e9c58b8a9efb5ab0"
    },
    {
      "path": "docs/scientific_hardening/CLAIMS_MATRIX.md",
      "sha256": "33d0e656131b6aea52c3a644f59f91c302b777014839ceb13e5f6f93758e8e6d"
    },
    {
      "path": "docs/scientific_hardening/GATE_TEST_REGISTRY.md",
      "sha256": "0c9d4e32a3811d7faaa3143a0c2334eaa917c1ff98d864c6c595c24837243df5"
    },
    {
      "path": "popgp/diagnostics.py",
      "sha256": "e2d2edd27be70976cd2c7592b5da6543b0eb8e15c68bb179a6019506eade6ba4"
    },
    {
      "path": "protocols/POPGP-VIABILITY-R3-2026-08/VIA-000-VALIDATOR-PACKAGE-INIT.py",
      "sha256": "9d8059d7d655894958e03be4eb8a7dd89b45caa639651545bb3950abcd65880c"
    },
    {
      "path": "reviews/viability/POPGP-VIABILITY-R3-2026-08/authorization/VIA-000-AUTHORIZED-SIGNERS",
      "sha256": "e011b5f846924080f93e7b9e827a886acc8b01f5620ac2e9aad6e9004d063c7f"
    },
    {
      "path": "schemas/viability/campaign-v2.schema.json",
      "sha256": "13ba43394a9ae4162d47fc44662232e9c51b73d3c0a32515ab81562f3007fbca"
    },
    {
      "path": "schemas/viability/independent-rereview-v2.schema.json",
      "sha256": "8b0a6e224abbf09a6b33890acdb628c15c82d083d2ae8bf7273ee2a26d01e567"
    },
    {
      "path": "schemas/viability/independent-review-v2.schema.json",
      "sha256": "032eedcdd5651bc8deaedf06ec20805aec028eaafad8ba0eea9d8acdcc76e8a1"
    },
    {
      "path": "schemas/viability/packet-v2.schema.json",
      "sha256": "9278b165eafcab04bd0989d489db3fe4fe881ade0c04e7f77cad5e9d69f5217d"
    },
    {
      "path": "schemas/viability/primary-protocol-v1.schema.json",
      "sha256": "d3360469bf7eb5b501da9eb42350df17fa946d5c9e598b20534240fcb7d8f801"
    },
    {
      "path": "schemas/viability/protocol-manifest-v2.schema.json",
      "sha256": "78f3c6a0dcf59a7ed134e5df2743cc7b9cdace8cc7b312af171a8c9e0381f10d"
    },
    {
      "path": "schemas/viability/review-response-v2.schema.json",
      "sha256": "0719e843fced8109e37f522e538be9905b7f43fcb42a06a3eb50239258785a1d"
    },
    {
      "path": "scripts/check_reproduction_boundary.py",
      "sha256": "69e56aba44f77d766a6faa27ca6a8adfaba7825c4b8429ab1b0d9b07408b671c"
    },
    {
      "path": "scripts/check_validation_artifacts.py",
      "sha256": "109c3505480ea3baaecdc1901e0bd78ada3207450141883ed92eeafa263096f7"
    },
    {
      "path": "scripts/check_viability_campaign.py",
      "sha256": "a907c78207f2583d76446dfc69a8e803211e7e3e0b6d61c5752d0fc5421ed731"
    }
  ],
  "packet_rule_sha256": {
    "VIA-000": "858fae0f281112d0f51482931097189c4b0b3ddc1091f417b7c305aaead05160",
    "VIA-010": "5061a90ec7ff5ccf11b875f0e64f7951020f79e4f3b91c691b28e4099ba6533a",
    "VIA-100": "b9b911474688a191dffe03ce14a5372e166465fa024d2430ed020b1a70d941d2",
    "VIA-150": "ec2879e91e12974ae64819d42382d200bb9e15170a6a3fc00ad15f91e51134ff",
    "VIA-200": "b5e440dfb8e4179621af771ae9e1d30061e0927d1b16e1ca05fb0bd029de72ab",
    "VIA-300": "165c040230fbbe984a7e4edc2a2bd786ae07dd6102d25ac4712641fcf11e50bc",
    "VIA-400": "12c1b0efc828688aa1f07f1a83bc0893addd37eefcd63cc8078b9883c02b954d"
  }
}
